model_comparison_results.csv

ML Model Name,Accuracy,AUC,Precision,Recall,F1 Score,MCC
Logistic Regression,0.49173098125689085,0.8937766684703063,0.8300204131589457,0.49173098125689085,0.5577946703720853,0.4087722582051475
Decision Tree,0.9134509371554576,0.930366895826057,0.923154783994864,0.9134509371554576,0.9174457950442618,0.8107136132378849
KNN,0.8384785005512679,0.8940794345711013,0.8343247335877628,0.8384785005512679,0.8224001114154124,0.5921244237380484
Naive Bayes,0.07276736493936053,0.6301807565943205,0.804827366201592,0.07276736493936053,0.05654872985167438,0.10364095583837894
Support Vector Machine,0.5573318632855567,0.938306799978985,0.8302227684363728,0.5573318632855567,0.6162272461172023,0.4452547454556616

README.md

### Observations on Model Performance

Achieved 49.17% accuracy and 0.8938 AUC. It demonstrated reasonable class-ranking performance but relatively weak classification accuracy.

Achieved 7.28% accuracy and 0.0565 weighted F1 score. It performed poorly on this dataset compared with the other classification algorithms.

Achieved 55.73% accuracy and the highest AUC of 0.9383. It demonstrated strong class-ranking performance but relatively low classification accuracy.